"Eyi fi ye wa wipe ti o ba wa, o ga ju wipe ti ko ba wa.","N’agbanyeghị ihe ndị a niile, Akwụkwọ Nsọ na-agwa anyị na ndịmmadụ ga-ajụ iheọmụma Chineke ahụ doro anya nke a pụghị ịgọpụ ma kwenyere ụgha n’ọnọdụ ya."
Kini otito naa?,Gịnị bụ ndụ ahụ?
"Ti emi mimo fin yin se alabojuto re, lati ma toju ijo Olorun, ti o ti fi eje ara re ra.","I nwere ike gbachìbìdo ya dịka onyenzuzu, i nwere ike ịbụ̄gara ya asọmmiri ma gbuo ya dịka ajọ mmụọ; maọbụ i nwere ike dàa n’ụkwụ ya ma kpọọ ya Onyenwe anyị na Chineke."
"Olorun nikan ni o le san gbese naa (Romu 5;8, 2 Korinti 5;21).","Naanị Chineke nwere ike ibū mmehie nke ụwa (2 Ndị Kọrịnt 5:21), nwụọ, ma kulitekwa n’ọnwụ, na-ègosi mmeri Ya n’ebe mmehie na ọnwụ dị."
Kini ile aye yi?,Gịnị bụ ụzọ ahụ?
Ba wo ni isoro yi se le yanju?,Ketu etu a pụrụ isi gbòo mkpa à?
Se ile aye dabi pe won ti tie mota?,"Ọ̀ nà-àdị gị kà ò nwèrè onye gbanyụrụ ọkụ, ì nwekwaghị ike ịchọta ihe e jị agbanye ya (sụ̀wiìch ya)?"
"2 Peteru 3:9 so wipe, Oluwa ko fi ileri re jafara bi awon elomiran iti ka ijafara: sugbon o nmu suru fun nyin nitori ko fe ki enikeni ki o segbe bi kose ki gbogbo enia ki o wa si ironupiwada.","2 Pita 3:9 nà-àgwa anyị, “… Ọ nà-àtachiri ụnụ̀ ogologo ntachiobi, n’ihi na Ò zubeghi ka ndị ọbụla laa n’iyì, kama ka mmadụ niile bịa rue nchegharị.” Ọ nà-àgụ Chineke agụụ ịgbāghàra anyị, n’ihi ya, O mèbèrè ọnọ̀dụ maka mgbaghara anyị."
"Iwe awon onitumo ti Webster so nipa kristiani “Enia ti o gbagbo ninu Jesu gege bi Kristi tabi nipa esin kiko Jesu.” Gege bi eyi se je igbese rere lati ni oye nipa kristiani, gege bi awon elomi ran si ti tumo re, o je ge bi ohun ti ko so idi naa dada nipa nipa otito bibeli lati le mo itumo kristiani.","Nkọwa nke akwụkwọ ọ̄kọwa okwu (dikshọnarị) nyere maka onye Kristian gà-àbụ ihe yitere “onye na-egosipụta nkwenye nà Jịzọs dịka Kraịst ahụ maọbụ n’òkpukperechī gbadoro ụkwụ na nkụzi ndị nke Jizọs.” Ebe nke a bụ̀ ebe mmalite dị mmā, dịka ọtụtụ nkọwa okwu nke ọkwụkwọ ọkọwa okwu (dikshọnarị), o bèrè ihe rute n’ebe o ruru, n’ịkụzi n’ezie eziokwu nke Akwukwọ Nsọ maka ihe ọ pụtara ịbụ onye Kristian."
Awon eniyan ti ko gbagbo ti ko si ni ireti ninu Jesu ma n pe ra won ni Kristiani nitori pe won ma n lo ile ijosin tabi won gbe inu ilu ti o je Kristiani.,"Ọtụtụ mmadụ ndị ekweghi na Jizọs Kraịst, ná-àtụkwasịkwa obi na Ya, nà-àhụta onwe ha gasị ka ndị kristian naānị maka nà ha nà-àga ụkà maọbụ na ha bi na mbā bụ̄ nke “Kristian”."
"Ti a ba wo Johannu 10;30, “Emi ati Baba mi, okan ni wa.” Ti a ba koko wo, ko da bi wipe ohun ni Olorun.","Lewis, n’akwụkwọ ya ọ kpọrọ Mere Christianity, nà-ède ihe ndị a nā-esote: “ana m agbalị n’ebe à igbochi onyeọbụla ikwū ihe ahụ bụ̄ ihe nzuzù n’ezie nke ndịmmadụ nà-àdị èkwube banyere Ya [Jizọs Kraịst]: ‘adị m nkwadobe inābàtà Jizọs dịka nnukwu onyenkụzi na-akuzi ihe ziri ezi na nke ezighi ezi, mana anaghị m anabata nkụ̀rụ nke Ọ nà-akụ̀rụ ịbụ̄ Chineke.’ Nke ahụ bụ otu ihe anyị agaghị ekwurịrị."
"Se o ti si orisirisi ilekun to je wipe ofo ati pe ko ni itumo, ohun ti o ba nibe ni yen?","Ị̀ nwàala (wee meghee) ọtụtụ ụzọ, ná-àchọpụ̀ta naanị nà ihe dị ha n’àzụ ghè oghēre bụrụkwa enweghi isi nà ọdụ̀?"
"Ise awon Aposteli 13:34 so wipe, “Nje ki o nyin, ara, pe nipase okonrin yi li a nwasu idariji es fun nyin.","Ọlụ Ndịozi 13:38 na-ekwupụta, “ya mere mara nụ nke a, ụmụnna m na a nà-èsite n’ọnụ onye à kwusaa mgbaghara mmehie niile nye ụnụ.”"
"Ko si ni ki awon enia ki won ma se sin ohun, gege bi angeli ninu Ifihan.","Kà a kpọzie ya nà okpukperechi dum bụ̄ ndị kacha mkpa nà-àkụzi nà Jizọs bụ onyeamụmụ maọbụ ezi onyenkụzi maọbụ nwoke nyefere onwe ya n’aka Chineke, na-efē Ya."
"Idariji je ifarahan ife, aanu ati ore-ofe.","Mgbaghara bụ òmùme nke ịhụnanya, ebere na amara."
"Bibeli je ki o ye wa wipe, gbogbo wa ni a nilo idariji lati odo olorun.",Akwụkwọ Nsọ na-agwa anyị na anyị niile nwere mkpa mgbaghara mmehie sitere nà Chineke.
"Johannu 3:16-17 fun wa ni iroyin iyanu yi wipe, “Nitori Olorun fe araye to bee ge ti o fi Omo re nikan so so fun wa, wipe enikeni ti o ba gbagbo ki o ma ba segbe sugbon ki o le ni iye ainipekun.","Jọn 3:16-17 nwere ozi à dị èbùbè, “n’ihi na Chineke hụrụ ụwa n’anya otu a, nà O nyere ọbụna Ọkpara Ọ murụ naanị Ya, ka onye ọbụla nke kwere nà Ya wee ghara ịla n’iyi, kama ka o nwee ndụ ebighi ebi."
"Ki ni idi ti awon Ju fe so Jesu ni okuta ti ko ba je wipe o so oro-odi ti won mon, bi Emi ni Olorun?",E kwuo ā gbaghaa ahụ̀ nà-amàlite mgbe a nà-èkwu maka isiokwu nke èjìrìmara zuru òkè gosipụtara Jizọs.
Tani wa lati jinyan pelu oro Olorun nipa ohun ti Jesu se tabi ti ko so?,Ndị Juu ghọ̀tàrà kpọmkwem ihe Jizọs nà-akụ̀rụ - chi.
Se iwo n wa ilekun si ona igbesi aye gidi?,Ọ̀ nà-àdị̀ (gị) kà onye ọbụla nà-èji gị achọrọ ọdịmma nke onwe (ya)?
Ijiya ti o to fun ese wa ni iku.,Naanị ǹtàràmahụhụ ziri ezi maka mmehie anyị bụ ọnwụ.
Ki ni o de ti a fi se?,Gịnị kpatara O jiri mee ya?
"2 Korinti 5:4 ko wa wipe, Nitori aw ti mbe ninu ago yi nkerora nitoto, eru npa wa: ki ise nitori ti awa nfe ije alaiwoso sugbon ki a le wo wa li aso ki iye ki o le gbe ara kiku mi.","Nkera nke mbụ nke Ndị Rom 6:23 nà-èkwuwàpụ̀ta, “n’ihi na ụgwọọlụ nke mmehie bụ ọnwụ…” Ọnwụ ebighi ebi bụ ihe anyị riteworo n’ụgwọ maka mmehie anyị."
Nitori naa o gba iya war a (2 Korinti 5: 21).,"Jizọs Kraist nwụrụ n’obe (Jọn 19:31-42), na-ewère ntaramahụhụ ahụ nke kwesịrị anyị (2 Ndị Kọrịnt 5:21)."
"Ikini, a ni lati mo pe awa ti dese si Oluwa: “Gbogbo enia li o ti se, ti won si kuna ogo Olorun” (Romu 3:23).","Nke mbụ, anyị gà-àmatarịrị nà anyị emehiela megide Chineke: “n’ihi nà mmadụ niile emehiewo, ha adịghị erụkwa otuto Chineke” (Ndị Rom 3:23)."
"Lehin ojo meta o si jinde (1 Korinti 15:1-4), to si fihan wipe o joba lori ese ati iku.” Eniti o tun wa bi, gege bi ajinde Jesu Kristi kuro ninu oku (1 Peteru 1:3).","Mkpụrụ ụbọchị àtọ na-esote, Ya site na ndị nwụrụ anwụ bilie (1 Ndị Kọrịnt 15:1-4), na-egosipụta mmeri Ya n’ebe mmehie nà ọnwụ dị."
"Tomasi omo leyin Jesu wipe, “Oluwa mi ati Olorun mi” (Johannu 20;28).","Ma etu ọ dị, lee mkpachìgha agwa nke ndị Juu maka okwu Ya, “Ndị Juu zara Ya, sị, ọ̀ bụghị n’ihi ọlụ ọma ka anyị nà-àtụ Gị nkume, kama ọ bụ̀ n’ihi nkwulù; n’ihi kwa na Gị onwe Gị, ebe Ị bụ mmadụ, Ị nà-ème onwe Gị Chineke” (Jọn 10:33)."
"Ohun kan ni o bere ile aye yi, ti gbogbo ohun ti o ri yi fi bere lati odo Olorun.",Ọ dịghị otù n’ime arụmụka ndị a nke pụrụ ime onye ọbụla jụrụ/na-ajụ inabata ihe a hụchasigoro anya ike kà o kwere.
Nje iwo mo ohun ti yio sele leyin aye yi?,Ị nà-echègharịba uche ihe ga-eme ma a gafèe ndụ à?
O si fi han wipe Oluwa mbe.,"Dịka ndị Kristian, anyị ma nà Chineke dị maka nà anyị nà-agwa ya okwu kwa ụbọchị."
"“Nitori oluwa fe araiye to be ge, ti o si omo bibi re kansoso fun ni, ki enikeni ti o ba gba gbo ma se segbe, sugbon ki o le ni iye ainipekun” (Johannu 3;16).","“N’ihi na Chineke hụrụ ụwa n’anya otu a, na O nyere ọbụna Ọkpara Ọ mụrụ naanị Ya, kaonye ọbụla nke kwere nà Ya wee ghara ịla n’iyi kama ka o nwee ndụ ebighi ebi” (Jọn 3:16)."
"A dupe wipe, Olorun wa kun fun ije ati aanu- o si yara lati dari awon ese wa ji wa!","Eklisiastis 7:20 na-ekwuwàpụ̀ta “ọ dịghị onye eziomume n’ụwa, nke na-eme ezi ihe, na-adịghị emehiekwa.” 1 Jọn 1:8 na-asị, “ọ bụrụ na anyị asị na anyị enweghi mmehie, anyị nà-èduhie onwe anyị, eziokwu ahụ adịghị kwa n’ime anyị.” Mmehie niile bụ òmùme ịgbā mgba megide Chineke (Abụ Ọma 51:4)."
"Efesu 1:7 so wipe, “Ninu eniti awa ni irapada wa ni pa eje re, idariji ese wa, gege bi oro ore-ofe re.” Jesé san igbese fun wa, nitori naa a lee ri idariji gba.","Ndị Efesọs 1:7 nà-àsị, “Onye anyị sitere n’ọbara Ya nwee mgbapụta anyị n’ime Ya, bụ ngbaghara nke ndahie niile anyị, dịka akụ nke àmàrà Ya si dị.” Jizọs kwụọrọ anyị ụgwọ, n’ihi ya a pụrụ ịgbaghara anyị."
"Nipa eyi, Bibeli so fun gbogbo enia won ko ni gbagbo nipa oye Oluwa, sugbon won yio gba iro gbo.","Ebe ọ bụ nà mmadụ sara mbara, ndị kā n’ọnụọgụ gbasàrà n’akụkọ ntolite niile nke mmadụ, n’omenàlà niile, na mmepe niile, nà na mpaghara mbā ụ̀wà dum kwenyere n’ịdị adị nke ụdị Chineke dị aṅaa, a gà-ènwerịrị ihe (maọbụ onye) na-akpata nkwenye à."
"Ninu ifihan, angeli so fun Johannu wipe Olorun nikan ni ki o fi oriba fun (Ifihan 19;10).","Tọmas onyeozi kwuwàpụ̀tàrà gwa Jizọs, “Onyenwe m nà Chineke m” (Jọn 20:28)."
