"Yesu hakunakiliwa mahali popote katika biblia akisema, “Mimi ni Mungu.” Lakini hiyo haimaanishi ya kwamba hakusema kuwa yeye ni Mungu.","Kà a kpọzie ya nà okpukperechi dum bụ̄ ndị kacha mkpa nà-àkụzi nà Jizọs bụ onyeamụmụ maọbụ ezi onyenkụzi maọbụ nwoke nyefere onwe ya n’aka Chineke, na-efē Ya."
Sote tumefanya dhambi.,Anyị niile emeela mmehie.
Tuliumbwa tuwe na uhusiano na Mungu.,E kere anyị ka anyị na Chineke na-enwe mmekọrịta.
"Mhubiri 3:11 inatuambia, “….ameweka pia umilele ndani ya mioyo ya wanadamu…” Kuna kitu ndani yetu kinachotujulisha ya kuwa kuna kitu zaidi baada ya maisha haya tunayoishi na mwingine zaidi yetu nje ya dunia hii.",Ya mere ọtụtụ n’ime ndị ahụ na-ajụ/na-agọpụ ịdị adị nke Chineke jị àmakụ̀dosi ike na ụ̀màndịrị (tiori) nke ‘naturalistic evolution’ (na-asị na ihe dị icheiche topụtara/ghọ̀rọ̀ ịhe ha bụ site n’otu ụdịdị iheokike nke bu ha ụzọ dịrị) - ọ na enye ha ihe ọzọ ha nwere ike ịhọrọ ma ha achọghị ikwere n’Onyeokike bụ Chineke.
Sisi ni wakina nani hata tupinge neno la Mungu kuhusu kile Yesu alisema ama kufanya?,"N’ihi nke a, Jizọs bụ Chineke!"
"Kwa mfano ni maneno ya Yesu katika Yohana 10:30, “ Mimi na Baba yangu ni mmoja.” Kwa mtazamo wa kwanza, hili linaweza kuwa si dai la kuwa Mungu.","Lewis, n’akwụkwọ ya ọ kpọrọ Mere Christianity, nà-ède ihe ndị a nā-esote: “ana m agbalị n’ebe à igbochi onyeọbụla ikwū ihe ahụ bụ̄ ihe nzuzù n’ezie nke ndịmmadụ nà-àdị èkwube banyere Ya [Jizọs Kraịst]: ‘adị m nkwadobe inābàtà Jizọs dịka nnukwu onyenkụzi na-akuzi ihe ziri ezi na nke ezighi ezi, mana anaghị m anabata nkụ̀rụ nke Ọ nà-akụ̀rụ ịbụ̄ Chineke.’ Nke ahụ bụ otu ihe anyị agaghị ekwurịrị."
"Kwanza, ni sharti tutambue yakwamba tumetenda dhambi kinyume chake Mungu: “Kwasababu wote wamefanya dhambi, na kupungukiwa na utukufu wa Mungu” (Warumi 3:23, TMP).","Nke mbụ, anyị gà-àmatarịrị nà anyị emehiela megide Chineke: “n’ihi nà mmadụ niile emehiewo, ha adịghị erụkwa otuto Chineke” (Ndị Rom 3:23)."
"Je, unatafuta njia ya kufikia maisha makamilifu?",Ọ̀ nà-àdị̀ (gị) kà onye ọbụla nà-èji gị achọrọ ọdịmma nke onwe (ya)?
"Yesu akasema, Amini, Amini nawaambia, kabla ya Abrahamu kuweko mimi nilikuwa.” Tena kwa ajili ya hayo wayahudi wakashika mawe ili wampige nayo Yesu (Yohana 8:59).","I nwere ike gbachìbìdo ya dịka onyenzuzu, i nwere ike ịbụ̄gara ya asọmmiri ma gbuo ya dịka ajọ mmụọ; maọbụ i nwere ike dàa n’ụkwụ ya ma kpọọ ya Onyenwe anyị na Chineke."
Yesu alichukua dhambi zetu (wakorintho wa pili 5:21).,Jizọs wèèrè mmehie anyị bo Onwe Ya (2 Ndị Kọrịnt 5:21).
Kila ajaye kwangu hatahisi njaa na aniaminiye hataona kiu” (Yohana 6:35).,"Jizọs sịrị, “Mụ onwe M bụ nri na-enye ndụ: onye na-abịakute M agụụ agaghị agụ ya ma ọlị, onye na-ekwerekwa na Mụ, akpịrị agaghị akpọ ya nkụ mgbe ọbụla” (Jọn 6:35)."
"Kama tukiweka imani yetu Kwake, kwa kuamini kifo chake pale msalabani kama malipo ya dhambi zetu, tutasamehewa na kupokea ahadi ya uzima wa milele kule mbinguni.","Ọ bụrụ nà anyị etinye okwukwe anyị nà Ya, na-atụkwasi obi n’ọnwụ Ya n’obe kà ọ kwụọ ụgwọ maka mmehie anyị, a gà-àgbaghàra anyị, anyị anatakwa nkwa nke ndụ ebighi ebi n’ime eluigwe."
Mataa ya kimaisha yataangaza tena.,A gà-àgbanyegasị ọkụ.
Atahakikisha njaa yetu imetoshelezwa.,Mgbe ahụ anyị ga-enwetezi agụụ nke mmụọ anyị dịka ihe e mere ka ọ kwụsị.
Muhimu ni kumkubali kwa imani (Waebrania 11:6).,"Na ngwụcha, ịdị adị Chineke bụ ihe a gà-ànabatarịrị site n’okwukwe (Ndị Hibru 11:6)."
Najua Mungu yuko kwa kuwa nazungumza naye kila siku.,"Dịka ndị Kristian, anyị ma nà Chineke dị maka nà anyị nà-agwa ya okwu kwa ụbọchị."
"Sote tumefanya mambo ambayo hayampendezi Mungu, ambayo yanafanya tustahili adhabu.","Anyị niile emeela ihe ndị anaghị atọ Chineke ụtọ, nke na-eme anyị ka anyị kwesi ntaramahụhụ."
"Je, kuna hali Fulani ya kutotosheka ndani yako?",Ọ̀ dị̀ ihe dị n’imeīme gị nke anaghị èmekata dịka è metala ya mma?
"Vibaya zaidi ni kwamba dhambi zetu zitasababisha kutengwa sasa na hata baada ya ufufuo, milele (Warumi 6:23; Yohana 3:36).","Nke jọkarịrị, mmehie anyị gà-ème anyị ka e kewapụ anyị na Chineke n’ime ụwa ebighi ebi niile, na ndụ nke a nà nke ọzọ (Ndị Rom 6:23; Jọn 3:36)."
Neno mkristo limetumika mara tatu katika agano jipya (Matendo 11:26; Matendo 26:28; Petero WA kwanza 4:16).,E jiri okwu ahụ bụ “Kristian” mee ihe ugboro atọ na Testament Ọhụụ (Ọlụ Ndịozi 11:26; 26:28; 1 Pita 4:16).
"Je, unashangazwa na kinachotendeka baada ya maisha haya?",Ị nà-echègharịba uche ihe ga-eme ma a gafèe ndụ à?
"Msamaha ni wa kupokelewa tu, kwa imani, kupitia neema na huruma za Mungu.","Site n’amara nà ebere Chineke, Ị pụrụ ịnara ya naanị nnara site n’okwukwe."
Kwa sababu ya dhambi zetu tumetengwa nje ya uhusiano huo.,"N’ihi mmehie anyị, e kewapụrụ anyị na mmekọrịta ahụ."
"Pale tunapo mkosea mtu, huwa tunatafuta msamaha kutoka kwao ili uhusiano wetu naye urudi kuwa mzuri.","Mgbe anyị mehiere mmadụ, anyị nà-àchọ mgbaghara ha ka e wee weghachite mmekọrịta."
Ni katika kumwamini Yesu Kristo pekee ndipo utakapopata msamaha wa dhambi.,Ọ bụ naanị ịtụkwasị obi na Jizọs Kraịst pụrụ inye/iwepụta mgbaghara mmehie.
"“kwa rehema zake nyingi alituzaa mara ya pili ili tupate tumaini lenye uzima kwa kufufuka kwake Yesu Kristo katika wafu” (1 Petro 1:3, TMP).","“Onye mụrụ anyị ọzọ, dịka oke ebere Ya si dị, ka anyị wee nwee olileanya dị̄ ndụ, site na mbilite ahụ nke Jizọs Kraist si na ndị nwụrụ anwụ bilie” (1 Pita 1:3)."
Wewe ni mwanadamu tu lakini unajifanya sawa na Mungu” (Yohana 10:33).,"“… Gị onwe gị, ebe Ị bụ mmadụ, Ị na-eme onwe Gị Chineke” (Jọn 10:33)."
"Waefeso 1:7 yasema, “katika yeye huyo, kwa damu yake, tunao ukombozi wetu, msamaha wa dhambi, sawasawa na wingi wa neema yake” (TMP).","Ndị Efesọs 1:7 nà-àsị, “Onye anyị sitere n’ọbara Ya nwee mgbapụta anyị n’ime Ya, bụ ngbaghara nke ndahie niile anyị, dịka akụ nke àmàrà Ya si dị.” Jizọs kwụọrọ anyị ụgwọ, n’ihi ya a pụrụ ịgbaghara anyị."
Ukweli ni nini?,Gịnị bụ eziokwu ahụ?
"Yesu alijibu swali hilo mwenyewe, “Upendo mkuu hakuna mwingine mwenye nao kama huu, kwamba atoe uhai wake kwa ajili ya rafiki” (Yohana 15:13).","Jizọs zara ajụjụ ahụ n’Onwe Ya: “ọ dịghị onye ọbụla nwere ịhụnanya karị nka uku, ka mmadụ tọgbọ ndụ ya n’ihi ndị enyi ya” (Jọn 15:13)."
"Mungu pekee ndiye angeweza kufidia dhambi za ulimwengu wote w (Wakorintho wa pili 5: 21), afe na afufuke kuthibitisha ushindi juu ya dhambi na mauti.","Na mgbalị ijì kọwàhìe (kọwaa duhìe) okwu ndị nke Jizọs, “ndịọ̀kàmmụ̀ta” ọ̀gbàràọhụụ nà-àsị nà “Jizọs nke eziokwu dị na mgbe gara aga” ekwughi ọtụtụ ihe Akwụkwọ Nsọ nà-ènyegasị Ya."
"Kwa bahati mbaya, neno mkristo limepoteza kwa kiwango kikubwa usawa wa matumizi yake na Linatumika mara kwa mara kumaanisha tu mtu mwenye dini au pengine muadilifu kinyume cha Mfuasi halisi wa yesu kristo aliyezaliwa mara ya pili.","Ọ dị mwute na dịka ogē nà-àgata, okwu a bụ̄ “Kristian” etufuola ihe buru ibu n’ihe ọ pụtara wee bụrụ ihe a nà-eji èkwube na mgbe nà mgbe maka onye na-ègosipụta okpukperechi maọbụ nwee ezi ndụ sitere n’ezi akọnauche n’ogo dị elu, mana o nwere ike ọ bụrụ maọbụ ọ bụghị onye na-eso ụzọ Jizọs Kraịst n’eziokwu."
Bibilia inaonyesha njia ya wazi ya uzimani.,Akwụkwọ Nsọ nà-egosi ọ̀wàụzọ a nà-àhụchasi ike nā-eduga na ndụ ebighi ebi.
"Yesu Kristo alikufa msalabani (Yohana 19:31-42), achukue adhabu ambayo sisi tulistahili (2 Wakorintho 5:21).","Jizọs Kraist nwụrụ n’obe (Jọn 19:31-42), na-ewère ntaramahụhụ ahụ nke kwesịrị anyị (2 Ndị Kọrịnt 5:21)."
Imani pekee katika kazi aliyo ikamilisha Kristo pale msalabani ndiyo njia ya kweli na pekee ifikayo uzimani!,Ọ bụ naanị ịtụkwasị obi na Kraịst pụrụ ịzọpụta gị site na mmehie.
"Je, watu wengine husababisha kushindwa kwako?",Ndịmmadụ ndị ọzọ ànà-eleda gị anya oge niile?
Kwa nini alifanya hivyo?,Gịnị kpatara O jiri mee ya?
"Swala muhimu linalompasa Yesu kuwa Mungu ni kwamba, kama si Mungu, kufa kwake hakungetosha kufidia dhambi za ulimwengu wote (Yohana wa kwanza 2:2).","Ihe e kere eke nwere ndụ, nke Jizọs gààrà abụ ma ọ bụrụ na Ọ bụghị Chineke, enweghi ike ịkwụ ụgwọ ahụhụ enweghi ngwụcha nke a chọrọ maka mmehie e mere megide Chineke enweghi ngwụcha."
"Je, uhusiano wako nao umekuwa si wa kina na bila muelekeo?","Mmekọrịta gị gasị, ọ̀ bụ̀ nà ha adị̄tọghị òmìmì, gheretọkwa oghe?"
Yesu alikufa ili tupate kuishi.,Jizọs nwụrụ ka anyị wee nwee ike ịdị ndụ.
"Na kwakuwa dhambi zetu tuzitendazo mwishowe ni dhambi zinazomlenga Mungu wa umilele, basi ni adhabu ya milele pekee tunayostahili kuadhibiwa.","Ebe ọ bụ nà mmehie anyị niile, ná ngwụcha ha, megidere Chineke nā-adịgide, naanị ǹtàràmahụhụ nā-adịgide bụ ihe zuoro ya."
Shida hii inawezaje kutatuliwa?,Ketu etu a pụrụ isi gbòo mkpa à?
"Bibilia inasema inatupasa kukubali kwa imani kuwa Mungu yuko, “Na pasipo imani haiwezekani mtu kumpendeza Mungu, kwa kuwa kila ajaye kwake sharti aamini kuwa yuko na ya kuwa huwapa vitu wale wamtafutao kwa bidii” (Waebrania 11:6).","Akwụkwọ Nsọ nà-àsị nà anyị gà-ànabàtarịrị site n’okwukwe eziokwu ahụ e mere nnwale nke bụ nà Chineke dị̀: “ma a sị na okwukwe adịghị, ọ bụ ihe a na-apụghị ime, bụ ime ihe gā-atọ Chineke ezi ụtọ : n’ihi na onye na-abịakute Chineke aghaghị ikwe na Ọ dị, na Ọ nà-ègosikwa Onwe Ya Onye na-enyeghachi ndị na-achọ Ya ụgwọọlụ” (Ndị Hibru 11:6)."
"Je, Yesu alisema yeye ni nani?",È mèkàtàrà nwee mgbe Jizọs kụ̀ọ̀rọ̀ nà Ya bụ̀ Chineke?
"Ina maana sawa na “Kuwa mmoja wa kundi la kristo” au “mfuasi wa kristo,” ambayo imefanana na tafsiri ya Neno hili katika kamusi ya Webster.","Okwu ahụ bụ “Kristian” na nghọta mkpurụokwu ya, pụtara “isò n’òtu nke Kraịst” maọbụ “onye na-eso ụzọ Kraịst.”"
"Kama unataka kumkubali Yesu Kristo kama mwokozi wako na kupokea msamaha toka kwa Mungu, hapa kuna ombi unalo weza kuomba.","Ọ bụrụ na ị chọrọ ịnabata Jizọs Kraịst dịka Onyenzọpụta gị wèe nara mgbaghara mmehie site nà Chineke, nke a bụ ekpere i nwere ike ikpe."
"Msamaha ni uamuzi wa kutoshikilia majungu yoyote juu ya mtu mwengine, haijalishi amekukosea kiasi gani.","Mgbaghara bụ̀ mkpebi ejigideghi ihe megide onye ọzọ, na-agbanyeghi ihe ha/o mèrèlà gị."
Mjadala huzuka wakati wa utambuzi kamili wa Yesu kristo unapojadiliwa.,E nwere ọtụtụ amaokwu nà isi edemede gasị nke Okwu Chineke e dere ede ndị nā-ekwu maka ọbụbụ chi nke Jizọs.
"Ndio, msamaha wapatikana kiurahisi namna hiyo!","Eē, ọ dị̀ mfe etu ahụ!"
Hali hii ya kutambua meme na mabaya ilitoka wapi Kama si kwa Mungu Mtakatifu?,"Ebe ọ bụ nà mmadụ sara mbara, ndị kā n’ọnụọgụ gbasàrà n’akụkọ ntolite niile nke mmadụ, n’omenàlà niile, na mmepe niile, nà na mpaghara mbā ụ̀wà dum kwenyere n’ịdị adị nke ụdị Chineke dị aṅaa, a gà-ènwerịrị ihe (maọbụ onye) na-akpata nkwenye à."
"Na kwasabu Yesu ni Mungu, kifo chake kilitoa msamaha wa dhambi kwa ulimwengu wote.","Dịka Chineke, ọnwụ Jizọs wepụtara mgbagbara mmehie maka mmehie nke ụwa niile."
"Si njaa ya chakula, lakini je, una njaa ya kitu Fulani zaidi maishani?",Ọ̀ bụghị agụụ ịgụ n’anụahụ; kama ì nwere agụụ maka ihe ka ukwu na ndụ?
Rudi kwa ukurasa wa nyumbani wa Kiswahili,Gịnị mere ajụjụ banyere ezi èjìrìmara gosipụtara Jizọs Kraịst jiri dị mkpà hinne?
"Mtume Paulo amtaja kama, “… Mungu wetu mkuu na mwokozi Yesu kristo” (Tito 2:13).","Taịtọs 2:13 nà-agbā anyị ume ichere maka ọbịbịa nke Chineke nà Onyenzọpụta anyị, Jizọs Kraịst (lekwuo 2 Pita 1:1)."
Ikiwa ndiyo hali unayopitia Yesu ndiye njia!,"Ọ bụrụ nà ọ dị otu a, Jizọs bụ ụzọ ahụ!"
Mkristo wa kweli ni mtu aliyeweka imani na tumaini lake lote ndani ya utu wa Yesu kristo na kukubali ya kwamba alikufa msalabani kwa fidia ya dhambi zetu na akafufuka tena siku ya tatu kupata ushindi dhidi ya kifo ili awape uzima wa milele wote wamwaminio.,"Ezi onye Kristian bụ onye tinyeworo okwukwe na ntụkwasịobi na mmadụ nke Jizọs Kraịst na ọrụ ya, tinyere ọnwụ Ya n’obe dịka ụgwọ Ọ kwụrụ maka mmehie nà mbilite n’ọnwụ Ya n’ụbọchị nke atọ ya."
