"Na kwakuwa dhambi zetu tuzitendazo mwishowe ni dhambi zinazomlenga Mungu wa umilele, basi ni adhabu ya milele pekee tunayostahili kuadhibiwa.","Ebe ọ bụ nà mmehie anyị niile, ná ngwụcha ha, megidere Chineke nā-adịgide, naanị ǹtàràmahụhụ nā-adịgide bụ ihe zuoro ya."
"Je, wakati mwingine maana ya maisha yako huionea shaka?",Ọ̀ nà-èmebe gị nà oge ụfọdụ ị̀ gaghị ekwetacha nà (ibi) ndụ nwere ihe ọbụla ọ pụtara?
Siku baada ya siku zamimina hotuba zake; usiku baada ya usiku zaonyesha ufahamu.,"Ǹgààrà ọ bụrụ nà ihe ndị gwakọtara ọnụ n’ikuku dị n’elu, jìrì nwantịntị ngụpụta pàseǹt olenole di iche, ọ gààrà àfọdụ obere ka ọ bụrụ nà ọ bụ ihe ọbụla nwere ndụ n’ụwa gà-ànwụ."
"Kwa shukurani, Mungu ni mwenye upendo na huruma-mwenye utayari wa kutusamehe dhambi zetu!",Ọ bụ ihe inye èkèle nà Chineke nà-àhụ (anyị) n’anya dịkwa ebere – na-ènwe ọchịchọ ịgbāghàrà anyị mmehie anyị!
"Biblia inasema, “Mbingu zatangaza utukufu wa Mungu; anga zatangaza kazi za mikono yake.","Ǹgààrà ọ bụrụ na ndị a ezughi, e nwekwuaziri ihemgbaàma Chineke n’ime obi anyị gasị."
"Msamaha - Je, mimi naupataje?",Mgbaghara mmehie – olee etu m gà-èsi nwete ya?
Hauwezi kumhonga Mungu ili akusamehe.,Ị̀ gaghị akwụli ụgwọ mgbaghara mmehie gị sitere na Chineke.
"Simsikii masikioni akinijibu lakini ninahisi uwepo wake, nahisi kuongoza kwake, najua upendo wake ninatamani neema yake.Mambo yaliyotendeka maishani mwangu hayana maelezo mengine ila Mungu.","Anyị anaghị ànụ n’ụ̀dà ka Ọ nà-àgwa anyị ihe, mana anyị na-enwe mmetụta nke nnọnyere ya, anyị na-enwe mmetụta nke odudu Ya, anyị ma ịhụnanya Ya, anyị nà-àchọba amara Ya."
"“Kwa sababu, ukimkiri Yesu kwa kinywa chako ya kuwa ni Bwana, na kuamini moyoni mwako ya kuwa Mungu alimfufua katika wafu, utaokoka” (Warumi 10:9, TMP).","“Na ọ bụrụ nà ị gà-ewère ọnụ gị kwupụta Jizọs nà Ọ bụ Onyenwe anyị, ọ bụrụkwa nà ị ga-ewere obi gị kwere nà Chineke mere ka O si na ndị nwụrụ anwụ bilie, a ga-azọputa gị” (Ndị Rom 10:9)."
"Basi kwa hivyo, tunahitaji kwa vyovyote msamaha wake Mungu.","N’ihi nke a, anyị nwere, n’etu dị egwụ, mkpa mgbaghara mmehie nke Chineke."
Maelezo haya yote hayawezi kumfanya mtu anayetaka kukataa kuwepo kwa Mungu akubali.,"Mana ọ bụru na O mere nke ahụ, à gaghị enwe mkpa ọbụla maka okwukwe."
"Mra nyingi Yesu katika maandiko aabudiwa (Mathayo 2;11; 14:33; 28:9,17; Luka 24:52; Yohana 9:38).","Onyeozi Pọl nà-àkọwa Ya dịka, “…Chineke ukwu ahụ, nke bụkwa Onyenwe anyị, Jizọs Kraịst” (Taịtọs 2:13)."
"Tomaso mwanafunzi wa Yesu alisema kuhusu Yesu, “Bwana na Mungu wangu” (Yohana 20:28).","Ma etu ọ dị, lee mkpachìgha agwa nke ndị Juu maka okwu Ya, “Ndị Juu zara Ya, sị, ọ̀ bụghị n’ihi ọlụ ọma ka anyị nà-àtụ Gị nkume, kama ọ bụ̀ n’ihi nkwulù; n’ihi kwa na Gị onwe Gị, ebe Ị bụ mmadụ, Ị nà-ème onwe Gị Chineke” (Jọn 10:33)."
"Sababu muhimu ya kwamba Yesu sharti awe Mungu ni kwamba kama si Mungu, kufa kwake hakungetoshea kufidia dhambi za ulimwengu wote (Yohana wa kwanza 2:2).","Lewis siri kọwaa n’okwu, ikwere nà Jizọs bụ̀ naānị ezi onyenkụzi esòghì n’ihe ndị a nà-àgbara nà ǹhọ̀ site n’ọ̀chịchọ onyē."
"Yohana 3:16-17 ina ujumbe huu wa kustaajabisha, “Kwa maana jinsi hii Mungu aliupenda ulimwengu, hata akamtoa mwanawe pekee, ili kila mtu amwaminiye asipotee, bali awe na uzima wa milele.","Jọn 3:16-17 nwere ozi à dị èbùbè, “n’ihi na Chineke hụrụ ụwa n’anya otu a, nà O nyere ọbụna Ọkpara Ọ murụ naanị Ya, ka onye ọbụla nke kwere nà Ya wee ghara ịla n’iyi, kama ka o nwee ndụ ebighi ebi."
Kujihisi kuwa maisha yako hayana maana ni kwa kutokuwepo kwa Mungu maishani mwako.,Oghere ahụ ị nà-ènwe mmetụta ya n’ime obi gị bụ Chineke Nke a chọtaghị na ndụ gị.
"kama ndiyo, tafadhali bonyeza kwa “Nime mkubali Kristo hivi leo” hapo chini.","“N’ihi na Chineke hụrụ ụwa n’anya otu a, na O nyere ọbụna Ọkpara Ọ mụrụ naanị Ya, ka onye ọbụla nke kwere na Ya wee ghara ịla n’iyi kama ka o nwee ndụ ebighi ebi” (Jọn 3:16)."
Hakuna hotuba au lugha ambayo haisikiki.,"Okwu ọnụ adịghị, ọ dịghịkwa okwu dị; a nụghị olu ha."
Njia ni nini?,Gịnị bụ ụzọ ahụ?
"Unahisi njaa, kujisikia kama uliyepotea gizani na maisha yako kukosa maana kwa kuwa umetengana na Mungu.","Ihe kpatara agụụ jì agụ gị, ihe kpatara i jì dị ka ì furu efu n’ọchịchịrị, ihe kpatara nà ị̀ pụghị ịchọta n’ime ndụ ihe ọ pụtara, bụ maka nà e kewapụrụ gị (pụọ) na Chineke."
C.S.,Jizọs Kraịst.
"Yesu alisema, “Amini, Amini nawaambia, kabla Abraham kuweko Nilikuwako.” Hali iliyowasukuma wayahudi kushika mawe iliwampige nayo Yesu (Yohana 8:59).",Ọlụ Ndịozi 20:28 nà-èkwupụ̀ta nà Chineke jiri ọbara nke onwe Ya zụrụ nzukọ Kraịst.
Kwa hivyo Yesu ni Mungu!,Ndị Juu ghọtara okwu Jizọs dịka nkụ̀rụ ịbụ Chineke.
"Siku tatu baadaye akafufuka katika wafu (1 Wakorintho 15:1-4), kudhihirisha ushindi Wake juu ya dhambi na mauti.","Mkpụrụ ụbọchị àtọ na-esote, Ya site na ndị nwụrụ anwụ bilie (1 Ndị Kọrịnt 15:1-4), na-egosipụta mmeri Ya n’ebe mmehie nà ọnwụ dị."
Tutajua ya kwamba tutaishi tena hata baada ya kufa – maisha baada ya ufufuo mbinguni milele na Yesu!,"Anyị ga-amara na anyị gà-ènwe ndụ ma anyị nwụchaa – ndụ a kpọlitere site n’ọnwụ, n’ime eluigwe, na-anọnyere Jizọs wee ruo ebighi ebi."
"Wafuasi wa yesu kristo waliitwa kwa mara ya kwanza “wakristo” antiokia (Matendo 11:26) kwa sababu tabia zao, matendo yao na hotuba zao zilikuwa kama za Kristo.","A kpọrọ ndị na-eso ụzọ Jizọs “ndị Kristian” mbụ n’Antịọk (Ọlụ Ndịozi 11:26) màkà nà òmùme ha, ihe ndị ha nà-ème, nà okwu ha dị̀ kà Kraịst."
"Yesu akajibu, “Mimi ndimi njia kweli na uzima.Hakuna afikaye kwa baba bila kupitia kwangu” (Yohana 14:6).","Jizọs zara, Mụ Onwe M bụ Ụzọ na Eziokwu na Ndụ: ọ dịghị onye ọbụla na-abịakute Nna M ma ọ bụghị site na Mụ” (Jọn 14:6)."
"1 Yohana 2:2 yasema, “Naye ndiye kipatanisho kwa dhambi zetu; wala si kwa dhambi zetu tu, bali na kwa dhambi za ulimwengu wote” (TMP).","1 Jọn 2:2 nà-èkwuwàpụ̀ta, “Ya Onwe Ya bụkwa ihe ịjụrụ Chineke obi banyere mmehie niile anyị,  mà Ọ bụghị Ihe ịjụrụ Ya obị banyere naanị mmehie nke anyị onwe anyị, kama Ọ bụkwa Ihe ịjụrụ Ya obị banyere mmehie nke ụwa dum.” Jizọs siri na ndị nwụrụ anwụ bilie, na-èkwuwàpụ̀ta mmeri Ya n’ebe mmehie na ọnwụ dị (1 Ndị Kọrint 15:1-28)."
"Lakini ukitazama majibizano ya wayahudi dhidi ya maneno yake, “Hatukupigi mawe kwa sababu nyinginezo ila kwa hili, kukufuru.",Jizọs anaghị èduzi/agbàziri ya.
"Je, umejaribu njia nyingi na kutambua ya kwamba kile ulichokitarajia hakipo ndani yake?","Ị̀ nwàala (wee meghee) ọtụtụ ụzọ, ná-àchọpụ̀ta naanị nà ihe dị ha n’àzụ ghè oghēre bụrụkwa enweghi isi nà ọdụ̀?"
Rudi kwa ukurasa wa nyumbani wa Kiswahili,"Ezi onye Kristian bụ nwa Chineke n’ezie, bụrụ akụkụ ezi ezinaụlọ nke Chineke, nà onye e nyeworo ndụ ọhụụ n’ime Jizọs Kraịst."
Msamaha wa dhambi zako upo ikiwa utamwamini Yesu Kristo kama mwokozi wa maisha yako.,Mgbaghara mmehie gị bụ ihe a pụrụ inwete mà ọ bụrụ na ị gà-ètinye okwukwe  gị na Jizọs Kraịst dịka Onyenzọpụta gị.
Mungu tu ndiye angeweza kufidia adhabu hiyo (Warumi 5:8; Wakorintho wa pili 5:21).,"Naanị Chineke nwere ike ibū mmehie nke ụwa (2 Ndị Kọrịnt 5:21), nwụọ, ma kulitekwa n’ọnwụ, na-ègosi mmeri Ya n’ebe mmehie na ọnwụ dị."
"“Kwa sababu, ukimkiri Yesu kwa kinywa chako ya kuwa ni Bwana, na kuamini moyoni mwako ya kuwa Mungu alimfufua katika wafu, utaokoka” (Warumi 10:9, TMP).","“N’ihi na ọ bụ amara ka e jiworo zopụta ụnụ, site n’okwukwe; nke a esiteghikwa n’onwe ụnụ: ọ bụ onyinye Chineke: o siteghi n’ọlụ, ka onye ọbụla wee ghara ịnya isi” (Ndị Efesọs 2:8-9)."
Ikiwa haya ndiyo uliyonayo basi Yesu ndiye njia!,Ajụjụ: Gịnị bụ atụ̀màtụ nke nzọpụta / ụzọ̀ nzọpụta?
"Je, unajisikia kama umefungiwa nje ya maisha yako?",Ọ̀ nà-èmekata ná-èmetụta gị (n’echiche) kà à kpọchìbìdòrò gị pụọ na ndụ?
"Unacho takiwa kufanya ni kumwomba Mungu akusamehe kupitia Yesu, huku ukiamini yakwamba Yesu alikufa ili upate msamaha-naye atakusamehe!","Ihe niile i nwere ime bụ rịọ Chineke ka Ọ gbaghara gị site na Jizọs, na-ekwere/kwere nà Jizọs nwurụ iji kwụọ ụgwọ maka mgbaghara mmehie gị - Ọ ga-agbagharakwa gị!"
Tutamjua rafiki yetu mwema na mchungaji pia.,Anyị ga-amara ezi Enyi anyị kachasi mma nà Onyeọzụzụatụrụ ọma.
Kila kitu kina fanya kazi vyema kwa wakati wake na kwa kipimo mwafaka.,Olee ebe nghọta nke ezi ihe nà ajọ ihe à siri bia mà ọ bụghị site na Chineke?
Yesu ndiye njia!,Jizọs bụ Ụzọ ahụ!
"Wao husema, “Niko tayari kumkubali Yesu kama mwalimu wa uadilifu tu lakini sikubali madai yake ya kuwa ni Mungu”.","Ọ dịghị mgbe e dèrè Jizọs n’Akwụkwọ Nsọ dịka Ọ na-ekwu kpọmkwem okwu ndị a, “abụ M Chineke.” N’atụmasịghị ya, nke ahụ apụtaghị na Ò kwuputaghị nà Ya bụ Chineke."
Una njaa?,Agụụ ọ̀ nà-àgụ gị?
Swahili,Igbo
"1 Yohana 1:8 asema, “Tukisema kwamba hatuna dhambi, twajidanganya wenyewe, wala kweli haimo mwetu”  (TMP).","Eklisiastis 7:20 na-ekwuwàpụ̀ta “ọ dịghị onye eziomume n’ụwa, nke na-eme ezi ihe, na-adịghị emehiekwa.” 1 Jọn 1:8 na-asị, “ọ bụrụ na anyị asị na anyị enweghi mmehie, anyị nà-èduhie onwe anyị, eziokwu ahụ adịghị kwa n’ime anyị.” Mmehie niile bụ òmùme ịgbā mgba megide Chineke (Abụ Ọma 51:4)."
Maoni ya tatu ni kwamba kwa chochote kufanyika lazima kuweko na mwenye au chenye kusababisha.,Ihe ọbụla mere gà-ènwerịrị ihe kpatara ya.
"Biblia inatuonya ya kuwa kuna wengine watakuwapo watakaokataa kuwepo kwa Mungu, “Mjinga amesema moyoni mwake hakuna Mungu” (Zaburi 14:1).","Ndịmmadụ na-ekwu na ha na-ajụ ịdị adị Chineke maka nà ọ “dịghị n’ụdị sayens” maọbụ “maka nà è nweghi ihengosipụta ya.” Nke bụ eziokwu bụ ihe kpatara ya bụ nà ozugbo ha kwetere na Chineke dị, ha gà-àghọtakwarịrị nà ha ga-enye nkọpụta ndụ ha n’aka Chineke ma ghọtakwa nà ha nọ na mkpa mgbaghara mmehie n’aka Ya (Ndị Rom 3:23, 6:23)."
"Je, unataka kuishi hata baadaya kufa?",Ị̀ chọ̀rọ̀ ịdị ndụ ma ị nwụchaa?
"Tito 3:5 inatuambia ya kwamba “si kwa matendo ya haki tuliyoyatenda, ila kwa huruma zake alituokoa kwa kutuosha na kutufanya upya kwa roho Mtakatifu.” Kwa hivyo mkristo nimtu aliyezaliwa mara ya pili na Mungu (Yohana 3:3; Yohana 3:7; Petero wa kwanza 1:23) na aliyeweka imani na tumaini lake lote ndani ya yesu kristo.","Taịtọs 3:5 nà-àsị “O siteghi n’ọlụ dị icheiche a lụrụ n’eziomume, nke anyị onwe anyi lụrụ, zọpụta ayị, kama dịka ebere Ya si dị, site n’ọsịsa nke ịmụ̄ ọ̀zọ na nke imē ọhụụ nke Mmụọ Nsọ nà-ème.” Ya mèrè, onye Kristian bụ onye Chineke mụ̄woro ọ̀zọ (Jọn 3:3; Jọn 3:7; I Pita 1̃:23) nke tinyeworo òkwùkwe na ntụkwasịobi nà Jizọs Kraịst."
Bibilia inatuambia ya kwamba sote tunahitaji msamaha toka kwa Mungu.,Akwụkwọ Nsọ na-agwa anyị na anyị niile nwere mkpa mgbaghara mmehie sitere nà Chineke.
"Je, wayahudi wangetaka kumpiga mawe yesu kama haingekuwa ya kuwa alisikika akikufuru kwa kusema yeye ni Mungu?",E kwuo ā gbaghaa ahụ̀ nà-amàlite mgbe a nà-èkwu maka isiokwu nke èjìrìmara zuru òkè gosipụtara Jizọs.
Waefeso 2:8 inatuambia ya kwamba “Kwa neema mmeokolewa kupitia imani wala si kwa ajili yenu wenyewe bali ni kipawa cha Mungu.” Mkristo wa kweli ni mtu aliyetubu dhambi zake na kuweka imani na tumaini lake ndani ya Yesu kristo pekee.,"Ndị Efesọs 2:8 nà-àgwa anyị na ọ bụ “… àmàrà kà e jīwòrò zọpụta ụnụ, site n’òkwùkwe; nke a esiteghikwa n’onwe ụnụ: ọ bụ onyinye Chineke.”"
Tukiweka imani zetu ndani ya yesu tukiamini kufa kwake kuwa fidia ya dhambi zetu – dhambi zetu zote zinasamehewa na kufutwa.,"Ọ bụrụ na anyị tinye okwukwe anyị n’ime Jizọs, na-atụkwasị obi n’ọnwụ Ya dịka ụgwọ mmehie anyị, a nà-àgbaghàra ma sachapụ mmehie anyị niile."
"Njaa unayoihisi ni njaa ya kiroho, na inaweza kutoshelezwa na Yesu.","Agụụ ahụ nā-agụ gị bụ agụụ nke mmụọ, naanị Jizọs pụkwara ime ka o nwete afọojuju."
"Waebrania 1:8, Baba asema juu ya Yesu, “Lakini juu ya mwana asema haya, “Na Kiti chako cha enzi, wewe Mungu, Kitadumu milele, na haki itakuwa fimbo ya ufalme wako.”",Jọn 1:1 nà-àsị “Okwu ahụ bụrụkwa Chineke.” Jọn 1:14 nà-àsị “Okwu ahụ wee ghọọ anụarụ bụ mmadụ.” Nke a na-egosi n’etu were anya nà Jizọs bụ Chineke nke nọ n’anụahụ.
"Hata hivyo Yesu Kristo, milele Mwana wa Mungu asiyekuwa na dhambi (1 Petro 2:22), alifanyika kuwa mwanadamu (Yohana 1:1,14) na akafa ili kutulipia adhabu yetu.","Ma etu ọ dị, Jizọs Kraịst, Onye enweghi mmehie (1 Pita 2:22), Ọkpara Chineke na-adịgide ghọ̀ọ̀rọ̀ mmadụ (Jọn 1:1, 14) wee nwụọ iji kwụọ ụgwọ ahụhụ dịịrị anyị."
"“Kwa maana mshahara wa dhambi ni kifo; lakini zawadi anayotoa Mungu ni uhai wa milele katika kuungana na Kristo Yesu, Bwana wetu” (Warumi 6:23, BHN).",“n’ihi na ụgwọọlụ nke mmehie bụ ọnwụ; ma onyinye amara nke Chineke bụ ndụ ebighi ebi n’ime Kraịst Jizos Onyenwe anyị” (Ndị Rom 6:23).
"Kwa hivyo, kama C.S.",Jọn 8:58 bụ ọmụmaatụ ọzọ.
"Je, ungetaka dhambi zako zisamehewe?",Ì chọ̀rọ̀ inweta mmehie gị gasị dịka ihe a gbaghààrà?
Tutapata nafasi ya kufikia maisha ya utimilifu.,Anyị ga-enwe ụzọ isi banye na ndụ na-enye afọojuju.
Msamaha - Kweli ni jambo rahisi namna hii?,Mgbaghara mmehie - ọ̀ dị̀ m̀fe etu ahụ n’ezie?
"Na Mungu asifiwe, kwani kwa kupitia kifo na kufufuka kwake Yesu Kristo, Warumi 6:23b yathibitika kwa kusema, “…bali karama ya Mungu ni uzima wa milele katika Kristo Yesu Bwana wetu”  (TMP).","Otuto dịrị Chineke (n’ihi nà) site n’ọnwụ na mbilte n’ọnwụ nke Jizọs Kraịst, nkera nke abụọ nke Ndị Rom 6:23 bụ eziokwu, “… ma onyinye amara nke Chineke bụ ndụ ebighi ebi n’ime Kraịst Jizọs Onyenwe anyị.”"
Hii ina maana ya kuwa Yesu ni Mungu katika mwili.,Ndị Juu ghọ̀tàrà kpọmkwem ihe Jizọs nà-akụ̀rụ - chi.
Yesu ndiye pekee anaweza kuondoa giza maishani mwako.,Naanị Jizọs bụ onye nwere ike ibupu ọchịchịrị ahụ.
Kuomba ombi hili au ombi lingine lolote lile haliwezi kukuokoa.,Ikpe ekpere a maọbụ ekpere ọzọ ọbụla agaghị azọpụta gị.
Kwa vile ulimwengu upo lazima kuwe na aliyeusababisha uweko na huyo ndiye Mungu.,"Ọ bụrụ na Chineke adịghị, n’ọnọdụ a anyị nwere ike ime ihe ọbụla anyị chọrọ n’echegbuweghi onwe anyị maka Chineke ikpe anyị ikpe."
"“Tena Yesu kamwambia, ‘kwa kuwa umeniona, umeamini; heri wale ambao hawakuniona na wameamini” (Yohana 20:29).","Ngọzi nà-àdịrị ndị akaàhụghị, ma ha kweere” (Jọn 20:29)."
Imani kwa Mungu si bure kama kubahatisha gizani bali ni sawa na kutembea salama ndani ya chumba chenye nuru ambamo asilimia 90 ya watu waliomo wamesimama.,Okwukwe n’ime Chineke abụghị ịwụnye n’anya ìsì n’ime ebe gbara ọchịchịrị; ọ bụ nzọpụ ụkwụ enweghi mmerụahụ n’ime ọnụụlọ nwere ìhè ọfụma ebe ndịmmadụ sara mbara bụ ndị ka n’ọnụọgụ gùzòwòròrịị̀.
"kama ndiyo, tafadhali bonyeza kwa “Nime mkubali Kristo hivi leo” hapo chini.","Jọn 1:12 nà-àgwa anyị “ma kà ha rà bụ ndị naāra Ya, ha kà O nyèrè ike ịghọ ụmụ Chineke, bụ ndị kweere n’aha Ya.” Akàra nke ezi onye Kristian bụ ịhụnanya nye ndị ọzọ nà nrubeisi nye Okwu Chineke (1 Jọn 2:4, 10)."
"Amina.” Biblia pia inasema, watu hawana sababu ya kutomwamini Mungu, “Kwa kuwa tangu kuumbwa kwa ulimwengu siri za uwepo wake – Nguvu zake za milele na utisho wake umethibitika na kufahamika kutokana na yale aliyoyatenda kwa hivyo wanadamu hawana kisingizio” (Warumi 1:20).","N’agbanyeghị ihe ndị a niile, Akwụkwọ Nsọ na-agwa anyị na ndịmmadụ ga-ajụ iheọmụma Chineke ahụ doro anya nke a pụghị ịgọpụ ma kwenyere ụgha n’ọnọdụ ya."
Msamaha ni nini na kwanini ninauhitaji?,"Gịnị bụ mgbaghara mmehie, gịnị kpatakwara m ji nwee mkpa inwe ya?"
"Je, nitajuaje kuwa Mungu yuko?",Olee etu anyị si ga-āma na Chineke dị?
"Je, umechoshwa na maisha ya kupigania tu vitu vinavyooza na kushika kutu?",Ọ̀ gwụla gị ike ibi ndụ gị nye ihe ndị ga-ere naanị ùre maọbụ gbaa nchāra?
"Neno “kusamehe” lahusu kuchukua hatua ya kutupilia mbali makwazo ya nyuma na kuanza upya, kuwia radhi, au kufuta deni linalodaiwa.","Mkpụrụokwu a bụ “gbaghàra” pụtara ihicha sèleèti ka ọ dị ọcha, ịtọ̄pụ/ịhāpụ (onye kwesiri ịta ahụhụ), ịkàgbù ụgwọ̄."
"Maana Mungu hakumtuma Mwana ulimwenguni ili auhukumu ulimwengu, bali ulimwengu uokolewe katika yeye” (TMP).",N’ihi na Chineke eziteghi Ọkpara Ya n’ụwa ka O kpee ụwa ikpe; kama ka e wee site n’aka Ya zọpụta uwa.”
"2 Wakorintho 5:21 inatufundisha, “Yeye asiyejua dhambi alimfanya kuwa dhambi kwa ajili yetu, ili sisi tupate kuwa haki ya Mungu katika yeye” (TMP).","2 Ndị Kọrịnt 5:21 nà-àkụziri anyị, “Onye ahụ Nke nā-amaghị mmehie kà O mere kà Ọ bụrụ mmehie n’ọnọdụ anyị; ka anyị onwe anyị wee ghọọ eziomume Chineke n’ime Ya.” Jizọs nwụrụ n’obe, na-ewere ahụhụ kwesiri anyị!"
"“Kwa maana jinsi hii Mungu aliupenda ulimwengu, hata akamtoa mwanawe pekee, ili kila mtu amwaminiye asipotee, bali awe na uzima wa milele” (Yohana 3:16, TMP).","“N’ihi na Chineke hụrụ ụwa n’anya otu a, na O nyere ọbụna Ọkpara Ọ mụrụ naanị Ya, kaonye ọbụla nke kwere nà Ya wee ghara ịla n’iyi kama ka o nwee ndụ ebighi ebi” (Jọn 3:16)."
Hakuna anaye stahili kusamehewa.,Ọ dịghị onye kwesiri ka a gbaghara ya.
Imani yao haimo ndani ya kufuata dini ama kanuni Fulani za uadilifu ama miongozo ya kusema fanya hiki na usifanye kile.,"Ịbụ̄ onyeòtu ǹkè otù ụkà, na-àgachite òfùfè anya, na-ènyekwa ihe maka ọrụ ụkà ahụ̀ anaghị eme gị onye Kristian."
Imani pekee katika kazi aliyo ikamilisha Kristo pale msalabani ndiyo njia ya kweli na pekee ifikayo uzimani!,Naanị okwukwe n’ime ọrụ ahụ gwụworo agwụ nke Kraịst n’obe bụ naanị ya bụ ọ̀wàụzọ nke eziokwu nā-eduga na ndụ ebighi ebi!
Jibu,A gà-ènwerịrị ihe mere ihe ọbụla jiri bịa dịrị.
Ilitumika kiasili na watu wasiookoka wa Antiokia kama jina la kimajazi kuwadhihaki wakristo hao.,"Nkọwa nke akwụkwọ ọ̄kọwa okwu (dikshọnarị) nyere maka onye Kristian gà-àbụ ihe yitere “onye na-egosipụta nkwenye nà Jịzọs dịka Kraịst ahụ maọbụ n’òkpukperechī gbadoro ụkwụ na nkụzi ndị nke Jizọs.” Ebe nke a bụ̀ ebe mmalite dị mmā, dịka ọtụtụ nkọwa okwu nke ọkwụkwọ ọkọwa okwu (dikshọnarị), o bèrè ihe rute n’ebe o ruru, n’ịkụzi n’ezie eziokwu nke Akwukwọ Nsọ maka ihe ọ pụtara ịbụ onye Kristian."
"2 Petro 3:9 yatuambia, “Yeye hutuvumilia maana hapendi mtu ye yote apotee, bali wote wafikilie toba”  (TMP).","2 Pita 3:9 nà-àgwa anyị, “… Ọ nà-àtachiri ụnụ̀ ogologo ntachiobi, n’ihi na Ò zubeghi ka ndị ọbụla laa n’iyì, kama ka mmadụ niile bịa rue nchegharị.” Ọ nà-àgụ Chineke agụụ ịgbāghàra anyị, n’ihi ya, O mèbèrè ọnọ̀dụ maka mgbaghara anyị."
Hata tukipuuza bado kuna uwepo wa Mungu maishani mwetu.,Ụdị nke a kacha wee mara n’arụmụka nke ọntọlọjii na-eji ntụpụta echiche bụ nke Chineke iji zipụta ịdị adị nke Chineke.
"Katika kitabu cha ufunuo wa Yohana, Malaika alimwamuru mtume Yohana kumuabudu Mungu tu(ufunuo wa Yohana 19: 10).","Tọmas onyeozi kwuwàpụ̀tàrà gwa Jizọs, “Onyenwe m nà Chineke m” (Jọn 20:28)."
Ilimlazimu Yesu kuwa Mungu ili alipe deni zetu.,Naanị Chineke nwere ike ịkwụ ụgwọ ụdị ahụhụ enweghi ngwụcha dị etu ahụ.
"Yesu alikufa kwa ajili yetu (Warumi 5:8), akachukua adhabu iliyotupasa sisi.","Ọ nwụrụ ọnwụ dịịrị anyị (Ndị Rom 5:8), na-ewere ǹtàràm̀ahụhụ kwesiri anyị."
"Kwanza tutazame maneno ya Yesu kutoka Yohana 10:30, “Mimi na Baba yangu ni mmoja.” Kwa mtazamo wa juu juu, hapa hakuna taswira ya kuwa yeye pia ni Mungu.","Mgbe Jizọs kwupụtara, “Mụ onwe m nà Nna M bụ otù” (Jọn 10:30), Ọ nà-èkwu na Ya na Nna ahụ nwere otù ọ̀dịdị nà njirimara kacha mkpa."
Ombi hili ni njia nyepesi ya kumwelezea Mungu imani yako kwake na kumshukuru kwa kukupea msamaha.,Ekpere à bụ naanị ụzọ iji gosi Chineke okwukwe gị n’ime Ya ma kelee Ya maka ọnọdụ O mè̀̀̀̀̀bèrè maka mgbaghara mmehie gị.
"Na ataitwa Mshauri wa ajabu, Mungu mwenye nguvu, Baba wa milele, mfalme wa amani.”","Na Ndị Hibru 1:8, Nna ahụ nà-èkwupụta maka Jizọs, “ma Ọ nà-èkwu ihe banyere Ọkpara ahụ, sị, Ocheeze Gị, Chineke, nadịru mgbe niile ebighi ebi; m̀kpànaka eze nke izi ezi ka m̀kpànaka nke alaeze Gị bụkwa.” Nna ahụ nà-àkọwa Jizọs dịka “Chineke” na-ègosi nà Jizọs bụ Chineke n’eziokwu."
"Anifuataye hatatembea gizani, bali atakuwa na nuru ya uzima” (Yohana 8:12).","Jizọs kwuwàpụ̀tàrà, “Mụ Onwe M bụ ìhe nke ụwa: onye nā-eso M agaghị ejegharị n’ọchịchịrị, kama ọ gà-ènwe Ìhe nke ndụ” (Jọn 8:12)."
"Je, umechanganyikiwa?",Ò jùrù gị anya?
"Msamaha ni ishara ya upendo, huruma na neema.","Mgbaghara bụ òmùme nke ịhụnanya, ebere na amara."
"Yohana 1:14 yasema, “ na neno akafanyika mwili”.","Na Nkpughe, otù mmụọozi gwara Jọn onyeozi kà ọ kpọọ isi ala nye naanị Chineke (Nkpughe 19:10)."
Mtu hapewi msamaha kwa sababu anastahili kusamehewa.,A naghị enye mgbaghara maka na mmadụ kwesiri ka a gbaghara ya.
"Yesu alisema, “Mimi ndimi huo ufufuo na uzima.","Jizọs kwuwàpụ̀tàrà, “Mụ Onwe M bụ Nbilite n’ọnwụ na Ndụ: onye na-ekwere na Mụ ọbụna ma a sị na ọ nwụrụ anwụ, ọ ga-adị ndụ ọzọ: ọzọ, onye ọbụla nke na-adị ndụ nke na-ekwerekwa na Mụ, ọ gaghị anwụ ma ọlị rue mgbe ebighi ebi” (Jọn 11:25-26)."
"Mungu, katika mpango wake mkamilifu, alifanyika kuwa mwanadamu - Yesu Kristo (Yohana 1:1, 14).","Chineke, n’ime atụmatụ Ya zuru òkè, ghọ̀ọ̀rọ̀ mmadụ - Jizọs Kraịst (Jọn 1:1, 14)."
"Je, nafsi yako yakuhukumu juu ya uasi wako na hata ukijitahidi, hainyamazi?","Ị̀ nà-ènwe mmetụta ahụ nā-enyekarị gị nsogbu, nke si n’obì ụtā, nke ọ dịghị kà ị̀ pụrụ ime ya kà ọ pụọ?"
Watu wengi wasioamini na kuwa na tumaini ndani ya yesu kristo hujichukulia tu kuwa ni wakristo kwa sababu wanahudhuria ibada za kanisa ama wanaishi katika taifa la kikristo.,"Ọtụtụ mmadụ ndị ekweghi na Jizọs Kraịst, ná-àtụkwasịkwa obi na Ya, nà-àhụta onwe ha gasị ka ndị kristian naānị maka nà ha nà-àga ụkà maọbụ na ha bi na mbā bụ̄ nke “Kristian”."
"“Bali Mungu aonyesha pendo lake yeye mwenyewe kwetu sisi, kwa kuwa Kristo alikufa kwa ajili yetu, tulipokuwa tungali wenye dhambi” (Warumi 5:8, TMP).","“Ma Chineke na-eme ka ihụnanya nke aka Ya n’ebe anyị nọ pụta ihe, n’ihi na, mgbe anyị nọ na-abụ ndịmmehie, Kraịst nwụrụ n’ihi anyị” (Ndị Rom 5:8)."
"Warumi 6:23a yasema, “Kwa maana mshahara wa dhambi ni mauti...” (TMP), Mauti ya milele ndicho tulichojipatia kama mshahara wa dhambi zetu.","Nkera nke mbụ nke Ndị Rom 6:23 nà-èkwuwàpụ̀ta, “n’ihi na ụgwọọlụ nke mmehie bụ ọnwụ…” Ọnwụ ebighi ebi bụ ihe anyị riteworo n’ụgwọ maka mmehie anyị."
Maoni ya kwanza yasema kwa kuwa Mungu ni kile ambacho zaidi yake hakuna.,E nweela ihe ndị mere na ndụ anyị enweghi nkọwa ọzọ kwere omume karịkwaa Chineke.
"“Kwa sababu, ukimkiri Yesu kwa kinywa chako ya kuwa ni Bwana, na kuamini moyoni mwako ya kuwa Mungu alimfufua katika wafu, utaokoka” (Warumi 10:9, TMP).",Cheta na ikpe ekpere a maobụ ekpere ọbụla ọzọ agaghị azọpụta gị.
